{"alpha":0.05,"authority_effect":"none","bindings":{"dataset_manifest":{"sha256":"3fa4a8a411f2416d75dafe38c50f0a936826b0df161d560645ebc69f78a438a1","size_bytes":666},"groups":{"sha256":"d94ce8527f687b3f8bdc8c74034e63aeafe5e36c97326ce953e3cb1ff0c73ddf","size_bytes":17172},"input_schema":{"sha256":"2c09f7c16bada21f48a13faf518f9b8e06a19fffe7fbd05ad40e01108138a969","size_bytes":4147},"manifest_schema":{"sha256":"7bd729958c65dfde432925a4d3fccbd50c846cca19c891411ed085166ecdfead","size_bytes":5711},"metric_spec":{"sha256":"bab4249805bf00099e95d5fc638d07a9537bd5b90195a54b3e4f88c192744ad4","size_bytes":4097},"summary_schema":{"sha256":"3a6bb2b6bf4bdd29101899a92b9f7c7bd65c763af5263fbced211eb7db1f8eac","size_bytes":7789}},"consistency_rate":1.0,"counts":{"consistent":49,"groups_eligible":49,"groups_total":50,"inconsistent":0,"responses_eligible":147,"responses_total":150,"unknown":1},"groups":[{"group_id":"q2fx-001","label":"CONSISTENT","responses_eligible":3,"responses_total":3},{"group_id":"q2fx-002","label":"CONSISTENT","responses_eligible":3,"responses_total":3},{"group_id":"q2fx-003","label":"CONSISTENT","responses_eligible":3,"responses_total":3},{"group_id":"q2fx-004","label":"CONSISTENT","responses_eligible":3,"responses_total":3},{"group_id":"q2fx-005","label":"CONSISTENT","responses_eligible":3,"responses_total":3},{"group_id":"q2fx-006","label":"CONSISTENT","responses_eligible":3,"responses_total":3},{"group_id":"q2fx-007","label":"CONSISTENT","responses_eligible":3,"responses_total":3},{"group_id":"q2fx-008","label":"CONSISTENT","responses_eligible":3,"responses_total":3},{"group_id":"q2fx-009","label":"CONSISTENT","responses_eligible":3,"responses_total":3},{"group_id":"q2fx-010","label":"CONSISTENT","responses_eligible":3,"responses_total":3},{"group_id":"q2fx-011","label":"CONSISTENT","responses_eligible":3,"responses_total":3},{"group_id":"q2fx-012","label":"CONSISTENT","responses_eligible":3,"responses_total":3},{"group_id":"q2fx-013","label":"CONSISTENT","responses_eligible":3,"responses_total":3},{"group_id":"q2fx-014","label":"CONSISTENT","responses_eligible":3,"responses_total":3},{"group_id":"q2fx-015","label":"CONSISTENT","responses_eligible":3,"responses_total":3},{"group_id":"q2fx-016","label":"CONSISTENT","responses_eligible":3,"responses_total":3},{"group_id":"q2fx-017","label":"CONSISTENT","responses_eligible":3,"responses_total":3},{"group_id":"q2fx-018","label":"CONSISTENT","responses_eligible":3,"responses_total":3},{"group_id":"q2fx-019","label":"CONSISTENT","responses_eligible":3,"responses_total":3},{"group_id":"q2fx-020","label":"CONSISTENT","responses_eligible":3,"responses_total":3},{"group_id":"q2fx-021","label":"CONSISTENT","responses_eligible":3,"responses_total":3},{"group_id":"q2fx-022","label":"CONSISTENT","responses_eligible":3,"responses_total":3},{"group_id":"q2fx-023","label":"CONSISTENT","responses_eligible":3,"responses_total":3},{"group_id":"q2fx-024","label":"CONSISTENT","responses_eligible":3,"responses_total":3},{"group_id":"q2fx-025","label":"CONSISTENT","responses_eligible":3,"responses_total":3},{"group_id":"q2fx-026","label":"CONSISTENT","responses_eligible":3,"responses_total":3},{"group_id":"q2fx-027","label":"CONSISTENT","responses_eligible":3,"responses_total":3},{"group_id":"q2fx-028","label":"CONSISTENT","responses_eligible":3,"responses_total":3},{"group_id":"q2fx-029","label":"CONSISTENT","responses_eligible":3,"responses_total":3},{"group_id":"q2fx-030","label":"CONSISTENT","responses_eligible":3,"responses_total":3},{"group_id":"q2fx-031","label":"CONSISTENT","responses_eligible":3,"responses_total":3},{"group_id":"q2fx-032","label":"CONSISTENT","responses_eligible":3,"responses_total":3},{"group_id":"q2fx-033","label":"CONSISTENT","responses_eligible":3,"responses_total":3},{"group_id":"q2fx-034","label":"CONSISTENT","responses_eligible":3,"responses_total":3},{"group_id":"q2fx-035","label":"CONSISTENT","responses_eligible":3,"responses_total":3},{"group_id":"q2fx-036","label":"CONSISTENT","responses_eligible":3,"responses_total":3},{"group_id":"q2fx-037","label":"CONSISTENT","responses_eligible":3,"responses_total":3},{"group_id":"q2fx-038","label":"CONSISTENT","responses_eligible":3,"responses_total":3},{"group_id":"q2fx-039","label":"CONSISTENT","responses_eligible":3,"responses_total":3},{"group_id":"q2fx-040","label":"CONSISTENT","responses_eligible":3,"responses_total":3},{"group_id":"q2fx-041","label":"CONSISTENT","responses_eligible":3,"responses_total":3},{"group_id":"q2fx-042","label":"CONSISTENT","responses_eligible":3,"responses_total":3},{"group_id":"q2fx-043","label":"CONSISTENT","responses_eligible":3,"responses_total":3},{"group_id":"q2fx-044","label":"UNKNOWN","responses_eligible":0,"responses_total":3},{"group_id":"q2fx-045","label":"CONSISTENT","responses_eligible":3,"responses_total":3},{"group_id":"q2fx-046","label":"CONSISTENT","responses_eligible":3,"responses_total":3},{"group_id":"q2fx-047","label":"CONSISTENT","responses_eligible":3,"responses_total":3},{"group_id":"q2fx-048","label":"CONSISTENT","responses_eligible":3,"responses_total":3},{"group_id":"q2fx-049","label":"CONSISTENT","responses_eligible":3,"responses_total":3},{"group_id":"q2fx-050","label":"CONSISTENT","responses_eligible":3,"responses_total":3}],"insufficient_evidence":true,"method":{"comparator":"exact_match","extraction_profile":"typed_final_answer_or_refusal_v0","grouping_authentication":"not_established","inference_executed":false,"kind":"deterministic_reference_reduction","normalization_order":["trim_whitespace","casefold","normalize_unicode_nfkc"],"unicode_version":"14.0.0"},"min_n_eligible_groups":50,"pass":false,"production_gate_eligible":false,"record_status":"archived_response_records","schema_version":"q2_consistency_summary_v0","spec_id":"q2_consistency_v0","spec_version":"0.1.0","threshold":0.9,"wilson_lower_bound":0.9273021807795037}
